935,https://github.com/github/docs/issues/19279,Please clean up documentation for /authorizations,content
936,https://github.com/github/docs/issues/19280,Language search tags displaying as empty when the repo contains code of that tag,content
937,https://github.com/github/docs/issues/19282,githubs-ssh-key-fingerprints should link to rest/meta,authentication
938,https://github.com/github/docs/issues/19283,Add host key verification failed to Troubleshooting SSH,authentication
939,https://github.com/github/docs/issues/19307,triggering_actor is not listed in the github context,actions
940,https://github.com/github/docs/issues/19311,Documentation says,invalid
941,https://github.com/github/docs/issues/19312,Fix docs to say that Github wiki Internal link format doesn't match MediaWiki link format,communities
942,https://github.com/github/docs/issues/19323,Explain how an action can dynamically determine its GITHUB_TOKEN permissions,actions
943,https://github.com/github/docs/issues/1933,Difficulty finding a post I just published from my Github Page,core
944,https://github.com/github/docs/issues/19342,No way to upload proof of academic status for education benefits,content
945,https://github.com/github/docs/issues/19355,Mention that no one else will know the current state of permission grants,content
946,https://github.com/github/docs/issues/19383,Authentication,invalid
947,https://github.com/github/docs/issues/194,Documenting error responses of REST API,content
948,https://github.com/github/docs/issues/1941,Unclear if transfer repo and associated redirect applies to releases,triage
949,https://github.com/github/docs/issues/19416,Incorrect return type for startsWith?,actions
950,https://github.com/github/docs/issues/19419,"I get a permission denied and I found a solution thanks to this Stackoverflow. It would be great if someone can point me to the right config for use custom key name.  Why: Closes [#19000 ]  What's being changed (if available, include any code snippets, screenshots, or gifs): Check off the following:  I have reviewed my changes in staging (look for the ""Automatically generated comment"" and click the links in the ""Preview"" column to view your latest changes).  For content changes, I have completed the self-review checklist. Writer impact (This section is for GitHub staff members only):  This pull request impacts the contribution experience  I have added the 'writer impact' label  I have added a description and/or a video demo of the changes below (e.g. a ""before and after video"")",content
951,https://github.com/github/docs/issues/19420,Add case-sensitivity note to HTTP verb documentation.,content
952,https://github.com/github/docs/issues/19503,Replace cross-marks ✖️ with tick-marks ✔️ to better represent permissions,content
953,https://github.com/github/docs/issues/19507,Using an underscore causes GitHub reusable workflow to be not found,actions
954,https://github.com/github/docs/issues/19521,"Missing example in ""Contacting support"" info for GitHub Actions",actions
955,https://github.com/github/docs/issues/19526,Update setup-java instructions to recommend Java 17 and Temurin,content
956,https://github.com/github/docs/issues/19541,Add help to install NuGet packages from a different repository,content
957,https://github.com/github/docs/issues/19559,Technology+Partner,invalid
958,https://github.com/github/docs/issues/19563,Poor instructions for getting starred_at property in stargazers endpoint,content
959,https://github.com/github/docs/issues/19566,Update cache action with correct snippet for Java-Maven example.,actions
960,https://github.com/github/docs/issues/19568,Invalid anchor on the GraphQL/Reference/Objects page,content
961,https://github.com/github/docs/issues/19580,Update link text for searching repositories by number of stars as per example,content
962,https://github.com/github/docs/issues/19590,Dropdown button is not readable on mouse hover,content
963,https://github.com/github/docs/issues/19593,state_reason missing from rest api issue docs,content
964,https://github.com/github/docs/issues/1960,Add CONTRIBUTING.md,invalid
965,https://github.com/github/docs/issues/19603,Hardikarya1995,invalid
966,https://github.com/github/docs/issues/19604,outdated screenshot  on renaming a repository page,invalid
967,https://github.com/github/docs/issues/19605,outdated screenshot on renaming a repository page,content
968,https://github.com/github/docs/issues/19624,Update confusing wording on using self-hosted runners in a workflow,content
969,https://github.com/github/docs/issues/19626,Mention that GITHUB_* and RUNNER_* can't be set using GITHUB_ENV (but that CI can be),actions
970,https://github.com/github/docs/issues/19627,Clarify that env vars are at least somewhat case insensitive on Windows,actions
971,https://github.com/github/docs/issues/19628,Org Webhook: Document settings for requesting all event types.,content
972,https://github.com/github/docs/issues/19631,Provide a unified page that talks about the pull request bottom box,content
973,https://github.com/github/docs/issues/19655,Issue templates are only case insensitive initially. ,communities
974,https://github.com/github/docs/issues/19656,OIDC on AWS documentation improvement,content
975,https://github.com/github/docs/issues/19667,Search merges lines from tables w/o whitespace,content
976,https://github.com/github/docs/issues/1967,Opening a throwaway issue to test a new workflow,triage
977,https://github.com/github/docs/issues/19671,Add GHES 3.6 Performance Numbers,content
978,https://github.com/github/docs/issues/1969,Dead link on Github Classroom: Leave feedback with pull requests,content
979,https://github.com/github/docs/issues/19690,H1-446593 Fixed about vulnerabilities found other in H1-1646084	,content
980,https://github.com/github/docs/issues/19712,Token for graphql explorer should have read:project access,content
981,https://github.com/github/docs/issues/19721,postbin.org has changed to https://www.toptal.com/developers/postbin/,invalid
982,https://github.com/github/docs/issues/19742,Missing 'runs.' on post-entrypoint configuration for dockefile actions,content
983,https://github.com/github/docs/issues/19808,"Thanks very much for contributing! Your pull request has been merged 🎉 You should see your changes appear on the site in approximately 24 hours. If you're looking for your next contribution, check out our [help wanted issues](https://github.com/github/docs/issues?q=is%3Aopen+is%3Aissue+label%3A%22help+wanted%22) ⚡",invalid
984,https://github.com/github/docs/issues/19809,Missing 'Optional' flag on branding configuration,content
985,https://github.com/github/docs/issues/1981,Suggestions and clarifications around the CONTRIBUTING file,content
986,https://github.com/github/docs/issues/19818,Examples of CODEOWNERS ! negation,code owners
987,https://github.com/github/docs/issues/19825,Best practices for security advisories doc should use positive statements,content
988,https://github.com/github/docs/issues/19862,Github Action page CSS break,engineering
989,https://github.com/github/docs/issues/19869,Update SSH Port 443 process to be useful.,content
990,https://github.com/github/docs/issues/19904,Fix misleading example of reusable workflows,actions
991,https://github.com/github/docs/issues/1992,Not matching URLs for emoji-cheat-sheet,Docs open source board
992,https://github.com/github/docs/issues/19922,App Manager: Crash report,invalid
993,https://github.com/github/docs/issues/19959,Web commit signing docs mention a restriction that isn't necessary,content
994,https://github.com/github/docs/issues/200,Testing an issue automation!,triage
995,https://github.com/github/docs/issues/20014,Difficult to read the text when we hover on the button ,engineering
996,https://github.com/github/docs/issues/20026,Fix ja-JP contexts.md layout,content
997,https://github.com/github/docs/issues/20037,"Change word from ""replace",content
998,https://github.com/github/docs/issues/20038,"Change word from ""replaced"" -> ""deleted"" in docs detailing deletion of content.",content
999,https://github.com/github/docs/issues/20057,Issues 2,invalid
1000,https://github.com/github/docs/issues/2006,"Check out ""WiFi Analyzer""",invalid
1001,https://github.com/github/docs/issues/20060,Add TSG for High CPU flag,triage
1002,https://github.com/github/docs/issues/20075,Table layout is broken in the ja-JP of the document,content
1003,https://github.com/github/docs/issues/20078,Github draft blog is out of date,content
1004,https://github.com/github/docs/issues/2008,dropdown content is outside the container,engineering
1005,https://github.com/github/docs/issues/20094,Add a dev container configuration to your repository (Node.js),Codespaces
1006,https://github.com/github/docs/issues/2010,Create a new release is documented as Draft a new release for GHE 2.21,core
1007,https://github.com/github/docs/issues/20103,"Leftovers
",invalid
1008,https://github.com/github/docs/issues/20112,Grammar fix on deployments page,content
1009,https://github.com/github/docs/issues/20114,"SSH commit signing: Missing ""key::"" prefix for literal key in setup instructions",authentication
1010,https://github.com/github/docs/issues/20134,"Case of X-Hub-Signature-256 header is incorrect in ""Securing your webhooks"" topic",content
1011,https://github.com/github/docs/issues/20136,Consistent use of the plural form of repository,content
1012,https://github.com/github/docs/issues/20137,SSH config PubkeyAcceptedKeyTypes directive for Error: Permission denied (publickey),authentication
1013,https://github.com/github/docs/issues/20145,"Managing Custom domain page > ""Configuring a subdomain"" > second example undifferentiated from first example",content
1014,https://github.com/github/docs/issues/2017,x,invalid
1015,https://github.com/github/docs/issues/2018,xx,engineering
1016,https://github.com/github/docs/issues/20182,UI Improvement: Issues with the navbar buttons and index sidebar,engineering
1017,https://github.com/github/docs/issues/2019,Update  issue_comment link in GitHub Actions docs,content
1018,https://github.com/github/docs/issues/20191,Document how to accept an invitation to a repository/organization,account-and-profile
1019,https://github.com/github/docs/issues/20196,Confusion on Troubleshoot CodeQL workflow page- Is go a compiled language or not?,content
1020,https://github.com/github/docs/issues/20202,Clarify reporting abuse in comments when the user is not a contributor.,content
1021,https://github.com/github/docs/issues/20216,Dismissing a review causes reviewed event to be in dismissed state,content
1022,https://github.com/github/docs/issues/20217,Remove extraneous <em> tags,content
1023,https://github.com/github/docs/issues/2022,rmmak,engineering
1024,https://github.com/github/docs/issues/20243,Git commit signature with SSH key state to use the public part for signing,content
1025,https://github.com/github/docs/issues/20249,Incorrect Layout: dependabot.yml options,invalid
1026,https://github.com/github/docs/issues/20256,Docs: Correct the word sprint to iteration,content
1027,https://github.com/github/docs/issues/2026,Kdkd,engineering
1028,https://github.com/github/docs/issues/20266,Fix documentation of repository_visibility field in OIDC token,actions
1029,https://github.com/github/docs/issues/2027,Jdmd,triage
1030,https://github.com/github/docs/issues/20289,'Attaching files' has missing important note,content
1031,https://github.com/github/docs/issues/20290,Review and fix potential typo in git clone feedback text copy,content
1032,https://github.com/github/docs/issues/203,Licensing is unclear,engineering
1033,https://github.com/github/docs/issues/2031,Documentation for runner.os on Environment variables page,actions
1034,https://github.com/github/docs/issues/20325,Update Gmail buttons screenshot,content
1035,https://github.com/github/docs/issues/2034,Merferan.com,invalid
1036,https://github.com/github/docs/issues/20356,Empty default value for auto_merge parameter in Create a Deployment documentation,content
1037,https://github.com/github/docs/issues/20358,dmarshclover ,invalid
1038,https://github.com/github/docs/issues/20379,GPG supported key algorithms ,content
1039,https://github.com/github/docs/issues/2038,Word Space Missing,content
1040,https://github.com/github/docs/issues/20395,https://bats-core.readthedocs.io/en/stable/,invalid
1041,https://github.com/github/docs/issues/2040,Please provide complete reference schema for each subkey of the context accessible in a workflow,actions
1042,https://github.com/github/docs/issues/20406,"Thanks for opening this pull request! A GitHub docs team member should be by to give feedback soon. In the meantime, please check out the [contributing guidelines](https://github.com/github/docs/blob/main/CONTRIBUTING.md).",invalid
1043,https://github.com/github/docs/issues/20408,G,invalid
1044,https://github.com/github/docs/issues/2041,user profile header alignment,engineering
1045,https://github.com/github/docs/issues/20413,Using internationalized domain for GitHub Pages,content
1046,https://github.com/github/docs/issues/20419,Typo on Copilot billing pt translation page,content
1047,https://github.com/github/docs/issues/20424,Missing Mastering Markdown page (that redirects to Basic Formatting) ,content
1048,https://github.com/github/docs/issues/20426,Update the UI elements in images to match the current elements,content
1049,https://github.com/github/docs/issues/20429,👋 Hey there spelunker. It looks like you've modified some files that we can't accept as contributions. The complete list of files we can't accept are:,invalid
1050,https://github.com/github/docs/issues/2044,.,invalid
1051,https://github.com/github/docs/issues/20440,<!-- MODIFIED_CONTENT_LINKING_COMMENT -->,invalid
1052,https://github.com/github/docs/issues/20454,"By default, dependabot only updates direct dependencies",content
1053,https://github.com/github/docs/issues/20456,Incorrect type of string for github.ref_protected property,content
1054,https://github.com/github/docs/issues/20459,Update GEI Managing Access section to include IP Allowlist configuration,content
1055,https://github.com/github/docs/issues/20465,Update self-hosted runners to support macOS ARM64,content
1056,https://github.com/github/docs/issues/2047,Tessa,invalid
1057,https://github.com/github/docs/issues/20478,"Neither looks wrong and tags are expected, but it explain paths.",content
1058,https://github.com/github/docs/issues/20482,C GitUP,invalid
1059,https://github.com/github/docs/issues/20487,clarify api usage limits in github actions,actions
1060,https://github.com/github/docs/issues/20489,Missing information about workflow creation through the API's,actions
1061,https://github.com/github/docs/issues/20495,fromJSON should include an example of an array for runs-on,actions
1062,https://github.com/github/docs/issues/205,Ready-to-use docs package,engineering
1063,https://github.com/github/docs/issues/20500,GitHub Copilot is now free for teachers,content
1064,https://github.com/github/docs/issues/20508,content error in shell example for GPG signing articles,content
1065,https://github.com/github/docs/issues/20529,Support toggle dark mode and light mode ,content
1066,https://github.com/github/docs/issues/20540,Doc on CODEOWNERS has a broken link for #syntax-expections,content
1067,https://github.com/github/docs/issues/20545,Removal of outlines on buttons in Github Docs Footer,content
1068,https://github.com/github/docs/issues/20546,Warn about scam emails impersonating Github on ,account-and-profile
1069,https://github.com/github/docs/issues/20547,7fa5f15317e3b069c3118e0fbe4e80ab860ffeea,invalid
1070,https://github.com/github/docs/issues/20548,3207a091f0ef083d96aa9172d0f2acb00f788fea,invalid
1071,https://github.com/github/docs/issues/20562,"Webricks currently not included by default in homebrew's ruby, leading to issues.",content
1072,https://github.com/github/docs/issues/20595,List followers of a user,content
1073,https://github.com/github/docs/issues/206,Include an observation and a link to PR templates at README.md,contributing docs
1074,https://github.com/github/docs/issues/20613,N667766NN667766N ,invalid
1075,https://github.com/github/docs/issues/20628,German translation,invalid
1076,https://github.com/github/docs/issues/2063,"[GitHub Actions] Rename example section titles in ""Workflow syntax for GitHub Actions""",Perkles
1077,https://github.com/github/docs/issues/20631,oauth redirect_uri documents a Host constraint that doesn't exist,content
1078,https://github.com/github/docs/issues/20654,Unclear how to get the ID value for pushActorIds in CreateBranchProtectionRuleInput,content
1079,https://github.com/github/docs/issues/20656,minor change but would help understanding how to do a code suggestion in a comment,content
1080,https://github.com/github/docs/issues/20679,GITHub Api missing repository language if repo is forked (@get /user/repos),content
1081,https://github.com/github/docs/issues/20689,Incorrect types of strategy context's properties,content
1082,https://github.com/github/docs/issues/20691,S,invalid
1083,https://github.com/github/docs/issues/20693,"This issue may have been opened accidentally. I'm going to close it now, but feel free to open a new issue with a more descriptive title or ask any questions in [discussions](https://github.com/github/docs/discussions)!",invalid
1084,https://github.com/github/docs/issues/20701,clarify needs context contains outputs from all jobs that are defined as a dependency of the current job,actions
1085,https://github.com/github/docs/issues/20711,Hover states make the content very difficult to see ,content
1086,https://github.com/github/docs/issues/20713,w,invalid
1087,https://github.com/github/docs/issues/20720,Incorrect link on About remote repositories page,content
1088,https://github.com/github/docs/issues/20741,The -K and -A flags are deprecated,content
1089,https://github.com/github/docs/issues/20744,github-event-types.md shows invalid attribute name,content
1090,https://github.com/github/docs/issues/2076,Those PDF references both give me 404s. Is that the correct reference or has it just not been uploaded yet? Thanks!,triage
1091,https://github.com/github/docs/issues/20761,Good 'contributing' *.md contents is not shown ?!,content
1092,https://github.com/github/docs/issues/20762,Per these docs we should be able to add callouts to markdown files.,triage
1093,https://github.com/github/docs/issues/20769,Add information about what happens with Gists after a username change,content
1094,https://github.com/github/docs/issues/20784,Explain how someone can sign the GitHub Marketplace Developer Agreement,actions
1095,https://github.com/github/docs/issues/20789,.....,invalid
1096,https://github.com/github/docs/issues/20790,Labels content,invalid
1097,https://github.com/github/docs/issues/20795,Issue event assigned does not have assigner,content
1098,https://github.com/github/docs/issues/20810,AE documentation should be clarified to include repo size limits,content
1099,https://github.com/github/docs/issues/20851,Spencer Marcu,invalid
1100,https://github.com/github/docs/issues/20852,body fitness and proper work out ,invalid
1101,https://github.com/github/docs/issues/20853, Comment module bug,content
1102,https://github.com/github/docs/issues/20855,Document new time zones feature,account-and-profile
1103,https://github.com/github/docs/issues/20872,reportingDescriptor name should mention pascal style constraint,code security
1104,https://github.com/github/docs/issues/20873,sarif-support-for-code-scanning should explain how each field is surfaced,code security
1105,https://github.com/github/docs/issues/20890,Remove <em> tags from code examples,content
1106,https://github.com/github/docs/issues/20908,Issue event: converted_to_discussion,content
1107,https://github.com/github/docs/issues/20912,Add ssh-add requirement for ssh commit signing,authentication
1108,https://github.com/github/docs/issues/20962,"Drafting an issue via curl uses non-escaped "" marks",content
1109,https://github.com/github/docs/issues/20970,Improve descriptions of job/workflow permissions,actions
1110,https://github.com/github/docs/issues/20973,> I think this is covered in the PR you are referencing,invalid
1111,https://github.com/github/docs/issues/20989,Document permission required to approve ✅ a pull request,content
1112,https://github.com/github/docs/issues/210,Improve documentation on variables and reusables,contributing docs
1113,https://github.com/github/docs/issues/21020,Add GPG format git configuration on GPG setup,content
1114,https://github.com/github/docs/issues/21038,capital gains ,invalid
1115,https://github.com/github/docs/issues/21045,Good boy,invalid
1116,https://github.com/github/docs/issues/2105,www.phownixpwn.com,invalid
1117,https://github.com/github/docs/issues/21060,Remove $ sign from code examples to avoid prompting errors/Improve the Docs,content
1118,https://github.com/github/docs/issues/21089,"Some cURL examples have non-escaped "" marks",content
1119,https://github.com/github/docs/issues/2110,Ubuntu-latest is not 18.04 anymore,Docs open source board
1120,https://github.com/github/docs/issues/21108,New secret scanning public key has not been published to API,content
1121,https://github.com/github/docs/issues/21113,workflow_dispatch contains branch-specific wording,actions
1122,https://github.com/github/docs/issues/21126,Translate a sidebar area in the spanish version,content
1123,https://github.com/github/docs/issues/21151,Clarify instructions for updating EOL's of repo HEAD,content
1124,https://github.com/github/docs/issues/21156,GITHUB_TOKEN does not have the correct rights to publish to private repos,actions
1125,https://github.com/github/docs/issues/21159,[Improvement]: Add link to Copilot docs in Using GitHub Copilot in GitHub Codespaces,content
1126,https://github.com/github/docs/issues/21165,Incorrect comment on GitHub Actions example,content
1127,https://github.com/github/docs/issues/21169,Add documentation for how to get ssh signed commits verified,authentication
1128,https://github.com/github/docs/issues/2117,Yakmus,engineering
1129,https://github.com/github/docs/issues/21173,Create personal access token link is broken.,content
1130,https://github.com/github/docs/issues/21199,Stefano Gambelli ,invalid
1131,https://github.com/github/docs/issues/21202,Discussions should be indicated in save replies about doc,content
1132,https://github.com/github/docs/issues/21207,Labels with periods do not render,content
1133,https://github.com/github/docs/issues/21210,The menu nor breadcrumb works on a mobile phone view,engineering
1134,https://github.com/github/docs/issues/21213,Add persian/farsi language to the document,content
1135,https://github.com/github/docs/issues/21218,a11y: the colour of the TOC does not meet colour contrast,engineering
1136,https://github.com/github/docs/issues/21221,Clarify behavior of properties.security-severity in SARIF files  ,code security
1137,https://github.com/github/docs/issues/21228,Organization Projects,invalid
1138,https://github.com/github/docs/issues/21229,Organization Projects,content
1139,https://github.com/github/docs/issues/21255,Typo,invalid
1140,https://github.com/github/docs/issues/21274,Good day!,invalid
1141,https://github.com/github/docs/issues/21310,Hovering over the items of sidebar blacks out the written text.,content
1142,https://github.com/github/docs/issues/21321,GitHub Pages (+ raw) bandwidth limits,content
1143,https://github.com/github/docs/issues/21324,"on.workflow_call.inputs.<input_id>.type includes invalid type (""choice"")",content
1144,https://github.com/github/docs/issues/21327,REST quickstart and guide examples still have a v3 reference in them for examples,content
1145,https://github.com/github/docs/issues/21333,MacOS 12+ - Narrow Host definition in .ssh/config,content
1146,https://github.com/github/docs/issues/2134,Description of when GitHub Actions are free is confusing.,actions
1147,https://github.com/github/docs/issues/21341,"Creating a composite action - Creating an action metadata file is using deprecated ""::set-output""",actions
1148,https://github.com/github/docs/issues/21343,'Locking conversations' article doesn't cover effect on reactions/votes,content
1149,https://github.com/github/docs/issues/21354,Resource not found for Github-desktop - page error,content
1150,https://github.com/github/docs/issues/21366,recovering-your-ssh-key-passphrase.md is outdated,content
1151,https://github.com/github/docs/issues/21389,"Some pages say ""the repository’s default branch (usually master)"" despite it being ""main"" more often now.",content
1152,https://github.com/github/docs/issues/21391,Some words were conjugated incorrectly and with wrong meanings (pt-BR),content
1153,https://github.com/github/docs/issues/21395,repositories are missing a paragraph break present for orgs/enterprises,content
1154,https://github.com/github/docs/issues/21396,"Hey, I would like to work on this but I didn't quite get the type of example one would be looking for here.",triage
1155,https://github.com/github/docs/issues/21397,"Thanks for opening this issue. A GitHub docs team member should be by to give feedback soon. In the meantime, please check out the [contributing guidelines](https://github.com/github/docs/blob/main/CONTRIBUTING.md).",
1156,https://github.com/github/docs/issues/21400,raw (% data variables.product.prodname_actions %} in run object,code security
1157,https://github.com/github/docs/issues/21409,"Make changes on a new branch in ""Contributing to projects""",content
1158,https://github.com/github/docs/issues/21424,Clarify $HOME environment variable in Actions docs,actions
1159,https://github.com/github/docs/issues/21435,"Check suites on a commit are not unique, despite the doc's claim",content
