0,https://github.com/github/docs/issues/10017,github.action description is wrong,actions
1,https://github.com/github/docs/issues/10026,Blank page when loading docs.github.com,engineering
2,https://github.com/github/docs/issues/10037,surani3725,invalid
3,https://github.com/github/docs/issues/10038,surani3725,invalid
4,https://github.com/github/docs/issues/10042,More precise description of dependabot's Gradle support,content
5,https://github.com/github/docs/issues/10047,Be y7,invalid
6,https://github.com/github/docs/issues/10075,[From Zendesk] Wiki in private repo can't be edited by users with Read or Triage access,help wanted
7,https://github.com/github/docs/issues/10087,Include information regarding the Let's Encrypt 64 character limitation for CN,content
8,https://github.com/github/docs/issues/10093,https://github.com/nodejs/node/blob/f182b9b29f6cdf0594498d4bd5b6efe562fc9ea6/.clang-format,invalid
9,https://github.com/github/docs/issues/10094,Update dependabot default time documentation,content
10,https://github.com/github/docs/issues/10112,Relationship between user status and team review assignment is not documented,content
11,https://github.com/github/docs/issues/10121,"""Considerations for code search"" says you need to include a search term, but that doesn't seem to be true",content
12,https://github.com/github/docs/issues/10126,Change flag case,Codespaces
13,https://github.com/github/docs/issues/10130,Query Variables pane in the GraphQL Explorer wipes contents unexpectedly,bug
14,https://github.com/github/docs/issues/10139,Incorrect activity type listed for the Discussion event in Actions,content
15,https://github.com/github/docs/issues/10156,zh-CN translation error ,content
16,https://github.com/github/docs/issues/10166,Rename default branch for github/.github,content
17,https://github.com/github/docs/issues/10167,Bao giờ hết covid,invalid
18,https://github.com/github/docs/issues/10168,CỨ NÓI ĐI ĐỪNG NGẠI,content
19,https://github.com/github/docs/issues/10177,Document Version of Feather Icons In Use,actions
20,https://github.com/github/docs/issues/10182,*,invalid
21,https://github.com/github/docs/issues/10188,CodeQL status check name is wrong,content
22,https://github.com/github/docs/issues/10197,Incorrect example for CommittableBranch input objec,content
23,https://github.com/github/docs/issues/10209,Make GHSA and CVE publication more distinct,content
24,https://github.com/github/docs/issues/10239,"Expression function ""contains"" array example does not work",actions
25,https://github.com/github/docs/issues/10250,Link to conditional requests is broken,content
26,https://github.com/github/docs/issues/10265,Maredroudina@gmail.com ,invalid
27,https://github.com/github/docs/issues/10269,essential-features-of-github-actions.md should explain how to download an artifact from the same workflow run,content
28,https://github.com/github/docs/issues/1027,Chinese version for Github Action Quickstart have an error,triage
29,https://github.com/github/docs/issues/10274,CONTRIBUTING.md Missing single character parenthesis ( to fix syntax for atom docs link,content
30,https://github.com/github/docs/issues/10276,self-review.md fix link to localization checklist,content
31,https://github.com/github/docs/issues/10295,Docs pages display HTML source code snippets instead of rendering the HTML,engineering
32,https://github.com/github/docs/issues/10320,Unsubscribe art positioning appears stale,content
33,https://github.com/github/docs/issues/10321,Pinned issues for https://github.com/github/docs/issues is stale,content
34,https://github.com/github/docs/issues/10333,Fix typographical errors on Contributing.md file,content
35,https://github.com/github/docs/issues/1034,Improve documentation for project board keyboard shortcut,good first issue
36,https://github.com/github/docs/issues/1035,Update 'Blocking a user from your personal account' content,good first issue
37,https://github.com/github/docs/issues/10350,Multi-OS terminal reusable seems incorrect,engineering
38,https://github.com/github/docs/issues/10375,Associating text editors: missing step ,content
39,https://github.com/github/docs/issues/10384,typo: support github runner page zh docs typo,content
40,https://github.com/github/docs/issues/10390,Invalid expression in a examples,actions
41,https://github.com/github/docs/issues/10409,traduction,invalid
42,https://github.com/github/docs/issues/10449,https://m.facebook.com/laistcy.hermosa,invalid
43,https://github.com/github/docs/issues/10461,Can we clarify the Identifying and Authorizing Users for GitHub Apps doc a bit?,content
44,https://github.com/github/docs/issues/10505,rest/reference/checks: clarification on conclusion stale,content
45,https://github.com/github/docs/issues/1052,"Hi guys,",triage
46,https://github.com/github/docs/issues/10578,Missing ci_activity in Notification Reasons,content
47,https://github.com/github/docs/issues/1059,คุณสามารถเลือกที่จะเชื่อมโยงบัญชีส่วนตัวของคุณเข้ากับไอคอนโซเชียลมีเดียบนโปรไฟล์ edX ของคุณ<br> <br> ลิงค์ Twitter<br> <br> &nbsp;ป้อนชื่อผู้ใช้ Twitter ของคุณหรือ URL ไปยังหน้า Twitter ของคุณ ลบ URL เพื่อลบลิงค์<br> <br> ลิงค์ Facebook<br> <br> &nbsp;ป้อนชื่อผู้ใช้ Facebook ของคุณหรือ URL ไปยังหน้า Facebook ของคุณ ลบ URL เพื่อลบลิงค์<br> <br> ลิงค์ LinkedIn<br> <br> &nbsp;ป้อนชื่อผู้ใช้ LinkedIn ของคุณหรือ URL ไปยังหน้า LinkedIn ของคุณ ลบ URL เพื่อลบลิงค์<br> <br>,engineering
48,https://github.com/github/docs/issues/10597,Feature request,invalid
49,https://github.com/github/docs/issues/10600,Discrepancy between gh auth login and docs,content
50,https://github.com/github/docs/issues/10609,Pull Request Template has outdated self-review link,content
51,https://github.com/github/docs/issues/1061,ลิงก์ไปยังหน้าสำหรับการลงทะเบียน&nbsp; https://clicks.pipaffiliates.com/c?c=546049&amp;l=th&amp;p=1<br>,triage
52,https://github.com/github/docs/issues/10612,Release notes: Fix typo and align yml properly,content
53,https://github.com/github/docs/issues/10628,Remove typo on github hosted runners pages,content
54,https://github.com/github/docs/issues/1068,https://ads.google.com/aw/accounts?ocid=592641105&hl=en&uscid=592641105&__c=7699323145&euid=431165753&__u=7800389297&cmpnInfo=%7B%228%22%3A%223a8bc26a-c00c-4854-83c6-7ba34c57dd10%22%7D&enableAllBrowsers=1&mobile=1,invalid
55,https://github.com/github/docs/issues/1069,@SEOGoddess []()1988,invalid
56,https://github.com/github/docs/issues/10786,Fix link to rest repo webhooks,content
57,https://github.com/github/docs/issues/10788,How to properly escape values for $GITHUB_ENV file,actions
58,https://github.com/github/docs/issues/1082,Pre-receive hooks/$GITHUB_VIA,content
59,https://github.com/github/docs/issues/10830,Document the character limit of labels,content
60,https://github.com/github/docs/issues/10833,Mention syntax for multi-line footnote text and named footnotes,content
61,https://github.com/github/docs/issues/10839,The href for a link points to a non-existent ID,content
62,https://github.com/github/docs/issues/1086,Directions for creating a new SSH key are inconsistent and fail if run as documented,triage
63,https://github.com/github/docs/issues/1087,Clarify permission level needed to access secrets,actions
64,https://github.com/github/docs/issues/10871,caught with Webhook payload not exist error while using workflow_run,actions
65,https://github.com/github/docs/issues/10929,Semoga lebih baik,triage
66,https://github.com/github/docs/issues/1093,Use real examples in API code examples,content
67,https://github.com/github/docs/issues/10932,PR template references non-existent anchor,content
68,https://github.com/github/docs/issues/10934,Fix an incorrect alt attribute in creating-a-pull-request.md,content
69,https://github.com/github/docs/issues/1094,"""Make a contribution"" button vs. includes",ecosystem
70,https://github.com/github/docs/issues/10943,"Changed organization's Settings sidebar ""Block a user"".",content
71,https://github.com/github/docs/issues/1096,Code block showing issue_comment PR vs issue differentiation not appearing correctly in docs,actions
72,https://github.com/github/docs/issues/10967,Provide detailed instructions on how to check for ssh-agent on Windows with OpenSSH,content
73,https://github.com/github/docs/issues/1099,A space should be added after a dot,Docs open source board
74,https://github.com/github/docs/issues/11007,inputs context is not listed in 'Contexts' page,content
75,https://github.com/github/docs/issues/11019,"Github Actions YAML python-version example should use strings, not floats",content
76,https://github.com/github/docs/issues/11030,Command in article to pull latest changes from branch of newly made repo is broken,content
77,https://github.com/github/docs/issues/1104,Explicit mention of having to use the baptiste preview,content
78,https://github.com/github/docs/issues/11071,Documenting error responses of GraphQL API,content
79,https://github.com/github/docs/issues/11073,Reference page for github markdown flavor does not reference footnotes,content
80,https://github.com/github/docs/issues/11077,Clarify content on ignoring files,help wanted
81,https://github.com/github/docs/issues/11078,A couple of errors in Issue event types page,content
82,https://github.com/github/docs/issues/11080,"Update ""Configuring nameservers using the administrative shell"" to include a note about 127.0.0.1",riteshsp2000
83,https://github.com/github/docs/issues/11081,[From Zendesk] Squash and merge mention in commit signing article now incorrect,help wanted
84,https://github.com/github/docs/issues/11082,Contributions when merging accounts,help wanted
85,https://github.com/github/docs/issues/11097,Building Actions: add a note about Dockerfile's capitalization,actions
86,https://github.com/github/docs/issues/11102,Update the description of how to view blocked users for a personal account,content
87,https://github.com/github/docs/issues/11129,Missing documentation for head_ref_force_pushed issue event,content
88,https://github.com/github/docs/issues/11131,"Wrong ""Create a commit comment"" link",content
89,https://github.com/github/docs/issues/11159,npm's documentation site is not linked to from docs.github.com,content
90,https://github.com/github/docs/issues/11167,Improve warning for handing out write level rights with regards to repo secrets,actions
91,https://github.com/github/docs/issues/11168,"How to find ""your teams"" isn't clearly documented yet",content
92,https://github.com/github/docs/issues/11181,broken link,invalid
93,https://github.com/github/docs/issues/11212,Redundant Section for PR Forks in [Learn Github Actions / Events That Trigger Workflows],actions
94,https://github.com/github/docs/issues/11215,Broken Integration for 'Triage new pull requests' Action ,content
95,https://github.com/github/docs/issues/11233,Developer API footer link leads to homepage,content
96,https://github.com/github/docs/issues/11236,GitHub Actions YAML should be placed under workflows directory (not workflow) [Building and testing Python],actions
97,https://github.com/github/docs/issues/11237,Use HTML kbd tag for keyboard information,content
98,https://github.com/github/docs/issues/11243,GitHub Actions: Examples for canceling in-progress jobs / runs with concurrency groups lead to confusing behavior,content
99,https://github.com/github/docs/issues/11272,Language picker doesn't update content on homepage,engineering
100,https://github.com/github/docs/issues/11274,Internal Footer links do not lead to selected translation page,engineering
101,https://github.com/github/docs/issues/11282,@rsese testing something please ignore!,content
102,https://github.com/github/docs/issues/11283,Kusmie00,invalid
103,https://github.com/github/docs/issues/11284,testing for @rsese,content
104,https://github.com/github/docs/issues/11293,Inconsistent markup of further reading links.,content
105,https://github.com/github/docs/issues/11307,Fix docs for generating migration archive,content
106,https://github.com/github/docs/issues/11319,CREATE ACCOUNT FOR CODE ,invalid
107,https://github.com/github/docs/issues/11336,Refine the warning of using PowerShell and UTF-8.,actions
108,https://github.com/github/docs/issues/11339,Bump download limit for deleting a public package to 5000,content
109,https://github.com/github/docs/issues/11344,Improve translation on verifying-or-approving-a-domain-for-your-organization.md ,content
110,https://github.com/github/docs/issues/11359,Object property names are unexpectedly being translated,content
111,https://github.com/github/docs/issues/11374,Elaborate on concurrency in GitHub actions,actions
112,https://github.com/github/docs/issues/11390,"Localization: YAML Keys, API Queries etc should not be translated",content
113,https://github.com/github/docs/issues/11396,"Improve table for Understanding the search syntax, exclude certain results",content
114,https://github.com/github/docs/issues/11447,provide more information for user 🥇,invalid
115,https://github.com/github/docs/issues/11448,Tags list items can also be written non-list item,actions
116,https://github.com/github/docs/issues/11469,No me gustan los archivos con virus,invalid
117,https://github.com/github/docs/issues/11472,Broken Integration for 'Triage new issue comments' Action,content
118,https://github.com/github/docs/issues/11476,Broken table translations for tables with conditional branching such as {% ifversion %},content
119,https://github.com/github/docs/issues/11481,"Add information about referencing issues, discussions, and PRs ",content
120,https://github.com/github/docs/issues/11490,"Add documentation for ""Update GitHub Action workflows""",content
121,https://github.com/github/docs/issues/11491,Mention gh_color_mode for directly uploaded images?,content
122,https://github.com/github/docs/issues/11499,tammavut2989@gmail.com,invalid
123,https://github.com/github/docs/issues/1150,Ayser Beats,invalid
124,https://github.com/github/docs/issues/11504,Bugs,invalid
125,https://github.com/github/docs/issues/11509,Update CFF types in the citation documentation.,content
126,https://github.com/github/docs/issues/11512,"Add a warning that ""Download a repository archive"" fails for empty repositories",content
127,https://github.com/github/docs/issues/11525,github-command-palette.md is missing from the repository,content
128,https://github.com/github/docs/issues/11534,OIDC w/ AWS example doesn't appear to be valid JSON,content
129,https://github.com/github/docs/issues/11547,Language menu hidden with the main part scrolled,engineering
130,https://github.com/github/docs/issues/1155,"""macOS"" should always be properly capitalized",content
131,https://github.com/github/docs/issues/11568,Content viewing(PT) impaired on mobile devices,content
132,https://github.com/github/docs/issues/11573,The DEPLOYMENT section in the GitHub Actions cannot expand,engineering
133,https://github.com/github/docs/issues/11586,"Missing documentation for GitHub Apps' ""Environments"" permission",content
134,https://github.com/github/docs/issues/11603,Additional TOTP options,content
135,https://github.com/github/docs/issues/11620,OIDC cloud-specific docs are missing environment variables,actions
136,https://github.com/github/docs/issues/11637,Inconsistencies with security and analysis feature toggle docs,content
137,https://github.com/github/docs/issues/11639,Inconsistency between SCIM support,content
138,https://github.com/github/docs/issues/1165,Puzzle zebra,invalid
139,https://github.com/github/docs/issues/1166,Java,engineering
140,https://github.com/github/docs/issues/11708,MGB ,invalid
141,https://github.com/github/docs/issues/11711,BTCBROWSER,invalid
142,https://github.com/github/docs/issues/11713,Escaping chars for workflow commands,actions
143,https://github.com/github/docs/issues/11715,Ju,invalid
144,https://github.com/github/docs/issues/11721,"update gh CLI steps in ""Adding a new SSH key to your GitHub account""",content
145,https://github.com/github/docs/issues/11729,The jobs.*.runs-on documentation seems incomplete,content
146,https://github.com/github/docs/issues/11762,Document Object Element Dereference Syntax,actions
147,https://github.com/github/docs/issues/11763,"Hello, I have a question on the data that builds this page, and want to ask if there are **TypeScript definitions** I can reference: https://github.com/github/docs/blob/main/content/actions/reference/workflow-syntax-for-github-actions.md",invalid
148,https://github.com/github/docs/issues/11776,## ✨ ✨ New layout ✨ ✨,invalid
149,https://github.com/github/docs/issues/11777,"Thanks for opening this issue. A GitHub docs team member should be by to give feedback soon. In the meantime, please check out the [contributing guidelines](https://github.com/github/docs/blob/main/CONTRIBUTING.md).",invalid
150,https://github.com/github/docs/issues/11778,docs: Correct id_token references,actions
151,https://github.com/github/docs/issues/1178,Add row with create/edit/delete labels rights overview to permission level table,Docs open source board
152,https://github.com/github/docs/issues/11784,"[Improvement]: Duplicate content in description of ""private"" parameter for Update a Repo endpoint",good first issue
153,https://github.com/github/docs/issues/11787,AWS OIDC Condition codeblock is formatted incorrectly,content
154,https://github.com/github/docs/issues/11789,"Link in Markdown is broken for article ""Resolving a merge conflict on GitHub""",content
155,https://github.com/github/docs/issues/11794,Legend,invalid
156,https://github.com/github/docs/issues/11810,[Improvement]: 404 on reverting-a-pull-request,good first issue
157,https://github.com/github/docs/issues/11811,Use correct capitalization for PowerShell,content
158,https://github.com/github/docs/issues/11830,Listed limitations of reusable workflows incomplete,content
159,https://github.com/github/docs/issues/11848,developer,invalid
160,https://github.com/github/docs/issues/11849,composite example does not run in Windows,actions
161,https://github.com/github/docs/issues/11875,Recommend gradle/gradle-build-action for invoking Gradle in GitHub Actions,content
162,https://github.com/github/docs/issues/11888,SSH key fingerprints: listed ECDSA and Ed25519 not working,content
163,https://github.com/github/docs/issues/1190,Style update for REST API docs intro,ecosystem
164,https://github.com/github/docs/issues/11901,[Improvement]: Provide a description for the code scanning permissions in Custom Roles docs,good first issue
165,https://github.com/github/docs/issues/11929,Unlock the email,content
166,https://github.com/github/docs/issues/11931,Update gh repo create documentation,content
167,https://github.com/github/docs/issues/11933,Zagraj ze mną w grę Coin Master,invalid
168,https://github.com/github/docs/issues/11976,SK SURAJ,invalid
169,https://github.com/github/docs/issues/11980,Partner owned product documentation ,invalid
170,https://github.com/github/docs/issues/1199,[GitHub Desktop] Add delete tags functionality,content
171,https://github.com/github/docs/issues/11991,Çekme,invalid
172,https://github.com/github/docs/issues/120,Incorrect description of GITHUB_WORKSPACE environment variable,actions
173,https://github.com/github/docs/issues/1200,[GitHub Desktop] Add new working with a fork flow,content
174,https://github.com/github/docs/issues/12005,gmalex952@gmail.com ,invalid
175,https://github.com/github/docs/issues/1201,[GitHub Desktop] Split diffs and discarding lines features,content
176,https://github.com/github/docs/issues/12011,"Échale un vistazo a ""Kiwi Browser - Fast & Quiet"".",invalid
177,https://github.com/github/docs/issues/12012,Add clear instructions to use git on ChromeOS devices,content
178,https://github.com/github/docs/issues/12019,"Link on ""Resolving a merge conflict on GitHub"" is broken.",content
179,https://github.com/github/docs/issues/1202,[GitHub Desktop] Stashing changes feature,content
180,https://github.com/github/docs/issues/12026,Rendering issue in Configuring OpenID Connect in Google Cloud Platform,content
181,https://github.com/github/docs/issues/12029,Guidance needed for troubleshooting Pages SSL cert provisioning when it hangs,content
182,https://github.com/github/docs/issues/1203,[GitHub Desktop] Disabling repo indicators feature,content
183,https://github.com/github/docs/issues/1205,Table with long words overlaps with sidebar,engineering
184,https://github.com/github/docs/issues/12074,Markup incorrectly surrounding tip with codeblock tags,content
185,https://github.com/github/docs/issues/12085,https://www.facebook.com/profile.php?id=100070249217378,invalid
186,https://github.com/github/docs/issues/12089,Workflow Template iconName is marked as required although it is optional,content
187,https://github.com/github/docs/issues/12093,Code snippet in ja/working-with-ssh-key-passphrases.md  is wrong,content
188,https://github.com/github/docs/issues/12094,The documentation suggests an invalid value for the name of a secret,actions
189,https://github.com/github/docs/issues/121,Alphabetical ordering of context properties,actions
190,https://github.com/github/docs/issues/12106,Immediate credit card approval ,content
191,https://github.com/github/docs/issues/12134,GrandSlam4k,invalid
192,https://github.com/github/docs/issues/12138,Update dependabot metadata field,mchammer01
193,https://github.com/github/docs/issues/12146,Hello world ,invalid
194,https://github.com/github/docs/issues/12150,git credential manager: update name/links,content
195,https://github.com/github/docs/issues/12167,Improve the docs.github.com site,invalid
196,https://github.com/github/docs/issues/1218,全民K歌,invalid
197,https://github.com/github/docs/issues/122,Update GitHub Packages reserved names and versions section,content
198,https://github.com/github/docs/issues/12251,Slow to respond during holidays!,Docs open source board
199,https://github.com/github/docs/issues/12274,Roadmap Changelog Data| Tweet on Twitter,invalid
200,https://github.com/github/docs/issues/12295,Undocumented pull_request_review_thread event,content
201,https://github.com/github/docs/issues/12298,Keyboard shortcut for Github Command Palette on Windows/Linux may be incorrect,content
202,https://github.com/github/docs/issues/12305,Text is wrapped too much look weird,content
203,https://github.com/github/docs/issues/12312,Tittle,invalid
204,https://github.com/github/docs/issues/12329,Correct workflow badge 'event' example to use 'on',content
205,https://github.com/github/docs/issues/12335,synchronize event not clear enough,actions
206,https://github.com/github/docs/issues/1236,Is it possible to migrate an OAuth app to Github app without asking users to re-authenticate?,content
207,https://github.com/github/docs/issues/12397,seksun11,invalid
208,https://github.com/github/docs/issues/12399,Remove section about disabling auto-generated table of contents,content
209,https://github.com/github/docs/issues/124,powershell and pwsh command discrepancy,actions
210,https://github.com/github/docs/issues/12401,Partner-owned,invalid
211,https://github.com/github/docs/issues/12403,Decrease size of strawberry emoji in REST API reference docs,engineering
212,https://github.com/github/docs/issues/12410,GITHUB_TOKEN scope column doesn't have the literal scopes,actions
213,https://github.com/github/docs/issues/12443,https://github.com/github/docs/tree/main/translations,invalid
214,https://github.com/github/docs/issues/12449,Error 503 certificate has expired - docs are down,content
215,https://github.com/github/docs/issues/12455,target-branch option for dependabot,content
216,https://github.com/github/docs/issues/12456,Document how the Wiki Sidebar is generated,content
217,https://github.com/github/docs/issues/12469,[data reusables] Typo in command_line.open_the_multi_os_terminal?,content
218,https://github.com/github/docs/issues/12482,Github docs,invalid
219,https://github.com/github/docs/issues/12487,Add a code sample for workflow_dispatch variables,content
220,https://github.com/github/docs/issues/1249,Add filter out info (-) to issue/PR search documentation,content
221,https://github.com/github/docs/issues/1253,Explain how to use environment variables in a test matrix,actions
222,https://github.com/github/docs/issues/12550,"This issue may have been opened accidentally. I'm going to close it now, but feel free to open a new issue with a more descriptive title or ask any questions in [discussions](https://github.com/github/docs/discussions)!",invalid
223,https://github.com/github/docs/issues/12556,"""Security advisory credit"" and ""discussion(s) answered"" missing from section ""Displaying badges on your profile""",content
224,https://github.com/github/docs/issues/12572,Document workflow_run behaviour when workflow name contains special characters,actions
225,https://github.com/github/docs/issues/12590,The issue_event_api_properties.md and pull_request_event_api_properties.md lose the edited action.,content
226,https://github.com/github/docs/issues/12596,"inside gist docs url grammatical errors, and extra curly brace for GitHub AE",content
227,https://github.com/github/docs/issues/12597,permissions list is missing value: pages ,content
228,https://github.com/github/docs/issues/12610,Ddgrtrdrrgbfr,invalid
229,https://github.com/github/docs/issues/12611,Вжвжцжузудтвшу8273г328929,invalid
